DÍA;Ubic;Horario;Latitude;Longitude
SÁBADO;TEPETL ESQ. CANTERA;08:00 A 19:00 HORAS;19,277845197;-99,186120621
DOMINGO;ESTACIONAMIENTO DE LA U. H. SAN PABLO XALPA;8:00 A 19:00 HORAS;19,505913292;-99,185740353
MARTES;ANDÉN DEL MERCADO AZCAPOTZALCO, ENTRE NUEVA JERUSALÉN;8:00 A 17:00 HORAS;19,483426102;-99,185497916
DOMINGO;INDEPENDENCIA, ENTRE LIBERTAD Y BOCANEGRA;8:00 A 19:00 HORAS;19,460498119;-99,184362045
LUNES;VOLCAN FERNANDINA /CDA. DE CALACOAYA Y VOLCAN JADE;08:00 A 19:00 HORAS;19,271267767;-99,183913793
MIÉRCOLES;CERRO DE LA TROJE / TLALPUENTE Y SIERRA DE SAN JUAN;08:00 A 19:00 HORAS;19,255691868;-99,183780808
JUEVES;CHANTEPEC Y CEHUANTEPEC;08:00 A 19:00 HORAS;19,274434230;-99,183248194
LUNES;PLATEROS ENTRE DAMAS Y CAPUCHINAS;6:00 A 16:00 HORAS;19,367192234;-99,183178692
LUNES;CALLE COPILCO ENTRE UNIVERSIDAD Y ODONTOLOGIA;8:00 A 19:00 HORAS;19,336885113;-99,182530034
VIERNES;COPILCO ENTRE UNIVERSIDAD Y ODONTOLOGIA;8:00 A 19:00 HORAS;19,336759610;-99,182323205
VIERNES;DEL PARQUE / INSURGENTES Y AV. SAN FERNANDO;08:00 A 19:00 HORAS;19,295092324;-99,182142619
MARTES;HOLBEIN ENTRE CORTEGIO Y CORDERO;6:00 A 16:00 HORAS;19,380584986;-99,182146127
JUEVES;NUBIA Y SAN LUCAS, DESDE HERALDO, HASTA PALESTINA;8:00 A 19:00 HORAS;19,471333545;-99,182111608
LUNES;BOSTON ENTRE RODIN Y DENVER;6:00 A 16:00 HORAS;19,379496934;-99,181748191
JUEVES;IRAPUATO, ENTRE CLAVERIA Y EGIPTO;8:00 A 19:00 HORAS;19,464186667;-99,181388367
MIÉRCOLES;VOLCAN ALEGRE / VOLCAN FERNANDINA Y VOLCAN FUJIYAMA;08:00 A 19:00 HORAS;19,270360448;-99,180981562
MARTES;2 DE ABRIL Y HERMES;6:00 A 16:00 HORAS;19,363960570;-99,180664973
DOMINGO;VOLCAN ALEGRE / VOLCAN FERNANDINA Y VOLCAN FUJIYAMA;08:00 A 19:00 HORAS;19,271037221;-99,180470498
LUNES;CEFIRO ENTRE PANAMERICANA Y DUMA;8:00 A 19:00 HORAS;19,305277864;-99,180333354
MARTES;CEFIRO ENTRE PANAMERICANA Y DUMA;8:00 A 19:00 HORAS;19,305277864;-99,180333354
DOMINGO;5 DE MAYO / AV. MÉXICO AJUSCO Y BENITO JUÁREZ;08:00 A 19:00 HORAS;19,232933406;-99,180240068
MARTES;JOSE MARTI ENTRE SALVADOR ALVARADO Y JOSE MARTI;07:00 A 17:00 HORAS;19,402983062;-99,180029975
VIERNES;CALLE THIERS ENTRE LEIBINITZ Y EUKEN;07:00 A 17:00 HORAS;19,434211154;-99,179934426
MIÉRCOLES;RIVERO / 5 DE MAYO Y JUÁREZ;08:00 A 19:00 HORAS;19,233956528;-99,179692672
SÁBADO;ZARAGOZA Y CALLE NUEVA / AV. INSURGENTES E INDEPENDENCIA;08:00 A 19:00 HORAS;19,293257409;-99,179647931
DOMINGO;ZARAGOZA Y CALLE NUEVA / AV. INSURGENTES Y AV. SAN FERNANDO;08:00 A 19:00 HORAS;19,295194494;-99,179538588
DOMINGO;FILADELFIA ENTRE PENSYNVANIA Y CDA DE ARIZONA;6:00 A 16:00 HORAS;19,394286271;-99,179630029
SÁBADO;MOPANES / APACHES Y CUAHUITECOS;08:00 A 19:00 HORAS;19,273546755;-99,179335034
LUNES;MAR BLANCO ENTRE MAR ADRIATICO Y MAR ROJO;07:00 A 17:00 HORAS;19,452489150;-99,179519271
JUEVES;LA FAMA / AYUNTAMIENTO Y CALLE DEL TRABAJO;08:00 A 19:00 HORAS;19,289916223;-99,179169540
JUEVES;CAROLINA ENTRE HOLBEIN Y AVILA CAMACHO;6:00 A 16:00 HORAS;19,382200724;-99,178811691
JUEVES;CAROLINA ENTRE HOLBEIN Y AVILA CAMACHO;6:00 A 16:00 HORAS;19,382037438;-99,178701616
MARTES;LA FAMA / AYUNTAMIENTO Y CALLE DEL TRABAJO;08:00 A 19:00 HORAS;19,289674139;-99,178588123
MARTES;RECREO ENTRE JOSE MARIA RICO Y TIGRE;6:00 A 16:00 HORAS;19,369934366;-99,178408747
VIERNES;MORAS, FRANCIA Y MINERVA;8:00 A 17:00 HORAS;19,355894306;-99,178140410
VIERNES;LAGO XOCHIMILCO ENTRE FELIPE CARRILLO PUERTO Y LAGUNA DE TAMIAHUA;07:00 A 17:00 HORAS;19,447684789;-99,178052271
DOMINGO;FILADELFIA ENTRE TEXAS Y NUEVA YORK;6:00 A 16:00 HORAS;19,393436863;-99,177970914
SÁBADO;PANTEÓN SANTA URSULA XITLA Y CANTERA;08:00 A 19:00 HORAS;19,280381573;-99,177825427
LUNES;LAGO XOCHIMILCO ENTRE LAGO CATEMACO Y LAGUNA DEL CARMEN;07:00 A 17:00 HORAS;19,449251204;-99,177688428
LUNES;CUERNAVACA, ENTRE CAMPECHE Y ALFONSO REYES “Tianguis Cuernavaca”;07:00 A 17:00 HORAS;19,410249364;-99,177558775
LUNES;LAGO XOCHIMILCO ENTRE CARRILLO PUERTO Y LAGO CATEMACO;07:00 A 17:00 HORAS;19,449872085;-99,177570968
MIÉRCOLES;HUASTECOS / LACANDONES Y CHINANTECOS;08:00 A 19:00 HORAS;19,272155087;-99,177298080
LUNES;MAR SONDA ENTRE MAR MARMARA Y MAR EGEO;07:00 A 17:00 HORAS;19,457432332;-99,176931516
JUEVES;NUEVA YORK ENTRE GEORGIA Y ALABAMA;6:00 A 16:00 HORAS;19,389815057;-99,176519492
VIERNES;TOPANTIAGUA, ENTRE  CENTRAL Y TLALTENCO;8:00 A 19:00 HORAS;19,491836905;-99,176455320
MIÉRCOLES;AV. DEL PARQUE Y CHICAGO;6:00 A 16:00 HORAS;19,396152665;-99,176193940
JUEVES;HOLBEIN Y AVILA CAMACHO;6:00 A 16:00 HORAS;19,383928996;-99,176142125
MARTES;PACHUCA ENTRE VERACRUZ Y JUAN DE LA BARRERA. “Tianguis Pachuca”;07:00 A 17:00 HORAS;19,418075719;-99,176062099
JUEVES;5 DE MAYO / CDA. 5 DE MAYO Y MIRASOL PROL. COL. SAN PEDRO MARTIR;08:00 A 19:00 HORAS;19,266323340;-99,175623488
DOMINGO;5 DE MAYO PROL. / CDA. 5 DE MAYO Y MIRASOL;08:00 A 19:00 HORAS;19,266847874;-99,175337126
SÁBADO;MORELOS ENTRE 5 DE MAYO E HIDALGO;8:00 A 17:00 HORAS;19,355211741;-99,175135926
DOMINGO;MIGUEL HIDALGO / 5 DE FEBRERO Y CARRETERA FEDERA A CUERNAVACA;08:00 A 19:00 HORAS;19,134994525;-99,174899968
SÁBADO;BAHIA DE SANTA BARBARA ENTRE BAHIA DE CHACHALACAS Y BAHIA DE PESCADORES;07:00 A 17:00 HORAS;19,436618051;-99,175208992
MARTES;MORELOS ENT. 5 DE MAYO E HIDALGO;8:00 A 17:00 HORAS;19,355224340;-99,175113386
MIÉRCOLES;BAHIA DE CHACHALACAS ESQUINA BAHIA DE SANTA BARBARA;07:00 A 17:00 HORAS;19,436428339;-99,174856222
MARTES;TRANSMETROPOLITANA / 5 DE MAYO Y CIPRESES;08:00 A 19:00 HORAS;19,246812310;-99,174589629
DOMINGO;5 DE MAYO PROL. / BARRANCA SAN JUAN DE DIOS;08:00 A 19:00 HORAS;19,267053647;-99,174495425
JUEVES;ANDRES OSUNA ENTRE ORDOÑEZ Y CERRADA ALBERTO CORREA;8:00 A 19:00 HORAS;19,330590919;-99,174562603
JUEVES;AV. IMAN ENTRE CHICOSMOSTOC Y AV. AZTECAS;8:00 A 19:00 HORAS;19,305963130;-99,174513042
JUEVES;AV. IMAN ENTRE CHICOSMOSTOC Y AV. AZTECAS;8:00 A 19:00 HORAS;19,305963130;-99,174513042
LUNES;AV. IMAN ENTRE CHICOSMOSTOC Y AV. AZTECAS;8:00 A 19:00 HORAS;19,305963130;-99,174513042
MARTES;JOSE MARTI ENTRE UNION Y JOSE MARTI;07:00 A 17:00 HORAS;19,401227114;-99,174573046
MARTES;COMUNAL ENTRE ADOLFO PRIETO Y ACACIAS;6:00 A 16:00 HORAS;19,363636887;-99,174233624
VIERNES;RÍO DE LA PLATA, ENTRE RÍO LERMA Y CIRCUITO INT. MELCHOR OCAMPO, “Tianguis Río de la Plata”;07:00 A 17:00 HORAS;19,426955546;-99,174261776
DOMINGO;1A. ORIENTE / BENITO JUÁREZ Y 1A. NORTE;08:00 A 19:00 HORAS;19,299653464;-99,174097444
JUEVES;BENITO JUÁREZ / 1A. ORIENTE Y 5A. ORIENTE;08:00 A 19:00 HORAS;19,298493715;-99,174081940
MARTES;BENITO JUÁREZ ESQ. VICENTE GUERRERO (SE NECONTRÓ EN VICENTE GUERRERO E HIDALGO);08:00 A 19:00 HORAS;19,135473032;-99,173404249
MIÉRCOLES;LAGO CUITZEO ENTRE LAGUNA DEL CARMEN Y LAGUNA DE TAMIAHUA;07:00 A 17:00 HORAS;19,447312345;-99,173692447
SÁBADO;AV. CIPRESES Y CAMINO AL CEDRAL;08:00 A 19:00 HORAS;19,245449067;-99,173396313
MIÉRCOLES;(INT. MERCADO OBRERO POPULAR) NORTE 67 Y PONIENTE 54;8:00 A 19:00 HORAS;19,463172545;-99,173507626
MARTES;BENJAMÍN HILL ENTRE OMETUSCO Y ALTATA “Tianguis Benjamín”;07:00 A 17:00 HORAS;19,406290512;-99,173340451
VIERNES;CAMPECHE, ENTRE NUEVO LEÓN Y SALTILLO “Tianguis Campeche”;07:00 A 17:00 HORAS;19,409005970;-99,173209697
SÁBADO;ADOLFO PRIETO ENTRE PARROQUIA Y JOSE MARIA RICO;6:00 A 16:00 HORAS;19,370076188;-99,173140056
VIERNES;BENITO JUÁREZ ESQ. VICENTE GUERRERO;08:00 A 19:00 HORAS;19,135947016;-99,172864828
MIÉRCOLES;EUGENIA Y MAGDALENA;6:00 A 16:00 HORAS;19,388632725;-99,172930338
MARTES;MAGDALENA ENTRE EUGENIA Y TIJUANA;6:00 A 16:00 HORAS;19,388836952;-99,172851033
VIERNES;MAGDALENA ENTRE EUGENIA Y TIJUANA;6:00 A 16:00 HORAS;19,388975712;-99,172810895
JUEVES;16 DE SEPTIEMBRE / REFORMA Y RIVAPALACIO E INT. DEL MERCADO;08:00 A 19:00 HORAS;19,251450171;-99,172638519
JUEVES;MATIAS ROMERO Y PATRICIO SANZ;6:00 A 16:00 HORAS;19,381623914;-99,172595060
MARTES;PORFIRIO DIAZ ENTRE PATRICIO SANZ Y GONZALEZ DE COSIO;6:00 A 16:00 HORAS;19,381679812;-99,172258192
LUNES;SALONICA A UN COSTADO DE LA U.H. CUITLAHUAC;8:00 A 19:00 HORAS;19,471459119;-99,172265375
VIERNES;SALONICA A UN COSTADO DE LA U.H. CUITLAHUAC;8:00 A 19:00 HORAS;19,471459119;-99,172265375
DOMINGO;DIAGONAL 5 DE MAYO ESQ. 5 DE MAYO / HERRERA Y CALLE ROSAL;08:00 A 19:00 HORAS;19,258278181;-99,171795318
VIERNES;ADOLFO PRIETO ENTRE PILARES Y TLACOQUEMECATL;6:00 A 16:00 HORAS;19,378486964;-99,170892775
MIÉRCOLES;LIMANTITLA / JUÁREZ Y CALLEJÓN SAN MARCOS;08:00 A 19:00 HORAS;19,281706661;-99,170785774
LUNES;CALLE 28-A ENTRE AV. 7-A Y J. O. DOMINGUEZ;07:00 A 17:00 HORAS;19,522766075;-99,170265104
VIERNES;ANACAHUITA Y COYAMEL ENTRE NESMEL Y AVENIDA DE LAS TORRES;8:00 A 19:00 HORAS;19,334970989;-99,169832107
VIERNES;AV. DEL IMÁN ENTRE CHICOSMOSTOC Y AV. AZTECAS;8:00 A 19:00 HORAS;19,311684114;-99,169549037
JUEVES;AHUANUSCO ENTRE PASCLE Y HUAMICHIL;8:00 A 19:00 HORAS;19,322189061;-99,169420025
MIÉRCOLES;CUITLAHUAC ESQ. LAS FUENTES;08:00 A 19:00 HORAS;19,296115628;-99,168978090
JUEVES;NUSTEPEC ENTRE TOLTECAS Y TEJAMANIL;8:00 A 19:00 HORAS;19,317617098;-99,168902981
DOMINGO;XILOTZINGO ENTRE GUAMUCHITL Y ANACAHUITA;8:00 A 19:00 HORAS;19,331599048;-99,168787971
DOMINGO;XILOTZINGO ENTRE GUAMUCHITL Y AILE;8:00 A 19:00 HORAS;19,331599048;-99,168787971
MARTES;CALZ. DE LOS  GALLOS ENTRE AV. CAMARONES Y FF.CC. DE CUERNAVACA;07:00 A 17:00 HORAS;19,456731476;-99,168800784
VIERNES;CALZ. DE LOS  GALLOS ENTRE AV. CAMARONES Y FF.CC. DE CUERNAVACA;07:00 A 17:00 HORAS;19,456731476;-99,168800784
LUNES;VICENTE GUERRERO Y LAS FUENTES;08:00 A 19:00 HORAS;19,297842007;-99,168323675
LUNES;XOCHIAPAN Y ACATEMPAN ENTRE AMESQUITE Y COPAL;8:00 A 19:00 HORAS;19,325904118;-99,168064039
LUNES;XOCHIAPAN ENTRE AMATL Y COPAL;8:00 A 19:00 HORAS;19,325904118;-99,168064039
MARTES;11 OTE. / LATERAL PERIFERICO Y 1A. NORTE;08:00 A 19:00 HORAS;19,300830229;-99,167911729
VIERNES;PROLONGACIÓN MOCTEZUMA ENTRE TECULIAPAN Y OMEGA;8:00 A 19:00 HORAS;19,342154096;-99,167813034
MIÉRCOLES;PROLONGACIÓN MOCTEZUMA ENTRE TECULIAPAN Y OMEGA;8:00 A 19:00 HORAS;19,342154096;-99,167813034
MIÉRCOLES;SAN BORJA Y COYOACAN;6:00 A 16:00 HORAS;19,385085744;-99,167753735
MIÉRCOLES;HERMANOS PINZON Y CRISTOBAL COLÓN;08:00 A 19:00 HORAS;19,273726293;-99,167265126
SÁBADO;COYAMEL ENTRE JUMIL Y TLAMATECA;8:00 A 19:00 HORAS;19,334144057;-99,167013997
LUNES;VELÁZQUEZ DE LEÓN, ENTRE ANTONIO CASO  Y FRANCISCO  COVARRUBIAS “Tianguis Velázquez”;07:00 A 17:00 HORAS;19,436223903;-99,166706952
JUEVES;AHUANUSCO ENTRE CICALCO Y TESNENE;8:00 A 19:00 HORAS;19,321022059;-99,166387982
JUEVES;COAPA /  CARRASCO E INDUSTRIA;08:00 A 19:00 HORAS;19,292978111;-99,166236461
LUNES;XOCHIAPAN ENTRE CICALCO Y PASCLE;8:00 A 19:00 HORAS;19,324897057;-99,166124969
SÁBADO;BAJÍO, ENTRE MANZANILLO E IGUALA   “Tianguis Bajío”;07:00 A 17:00 HORAS;19,403202227;-99,166063822
SÁBADO;LLAMAPAN / CARRASCO Y QUECHOLOC;08:00 A 19:00 HORAS;19,298546104;-99,165660517
LUNES;TEZOQUIPA / CALZ. DE TLALPAN Y MATAMOROS;08:00 A 19:00 HORAS;19,282302218;-99,165488284
VIERNES;MEDELLÍN, ENTRE INSURGENTES Y YUCATÁN “Tianguis Medellín”;07:00 A 17:00 HORAS;19,414894675;-99,165415227
VIERNES;VIOLETA / LETERAL CARRETERA A CUERNAVACA Y 5 DE MAYO;08:00 A 19:00 HORAS;19,265286950;-99,165228630
MIÉRCOLES;SULLIVAN ENTRE MANUEL MARÍA CONTRERAS Y GABINO BARREDA “Tianguis Sullivan Miércoles”;07:00 A 17:00 HORAS;19,434609338;-99,165294764
MIÉRCOLES;ORO, ENTRE MONTERREY Y PLAZA DE LA CIBELES “Tianguis Oro”;07:00 A 17:00 HORAS;19,419350167;-99,165173219
SÁBADO;ORO, ENTRE MONTERREY Y PLAZA DE CIBELES “Bazar del Oro”;07:00 A 17:00 HORAS;19,419350167;-99,165173219
LUNES;VIOLETA / LETERAL CARRETERA A CUERNAVACA Y 5 DE MAYO;08:00 A 19:00 HORAS;19,266266496;-99,164847433
JUEVES;PUENTE DE XOCO Y SAN FELIPE;6:00 A 16:00 HORAS;19,362142559;-99,164930136
JUEVES;PILARES Y NICOLAS SAN JUAN;6:00 A 16:00 HORAS;19,377636894;-99,164844210
VIERNES;CIRCUITO PERGOLEROS Y CAMINO VIEJO A SAN PEDRO;08:00 A 19:00 HORAS;19,277004251;-99,164367853
LUNES;CARRASCO / CANACALCO Y CUANACAZTLA;08:00 A 19:00 HORAS;19,299653199;-99,164339725
JUEVES;CALLE 28 ENTRE CALLE 1-A Y CALLE 1-B;07:00 A 17:00 HORAS;19,524635212;-99,164520941
LUNES;PAPALOTLENTRE AZULCO Y AZTAHUACAN;8:00 A 19:00 HORAS;19,327615126;-99,163526009
LUNES;PAPALOTLENTRE AZULCO Y AZTAHUACAN;8:00 A 19:00 HORAS;19,327615126;-99,163526009
SÁBADO;SULLIVAN ENTRE MANUEL M. CONTRERAS Y ROSAS MORENO  “Tianguis Sullivan Sábado”;07:00 A 17:00 HORAS;19,433925569;-99,163613377
LUNES;REY HUEMAN ENTRE AVENIDA AZTECAS Y TOTONACAS;8:00 A 19:00 HORAS;19,318619044;-99,163169981
DOMINGO;PEDRO ENRIQUEZ UREÑA ENTRE PIPIZAHUA Y ANACAHUITA;8:00 A 19:00 HORAS;19,335257066;-99,163152989
MARTES;ÁLZATE, ENTRE CEDRO Y NOGAL “Tianguis Cedro”;07:00 A 17:00 HORAS;19,447968689;-99,163212453
JUEVES;PEDRO ENRIQUEZ UREÑA ENTRE CANAULTLI Y EMEZQUITE;8:00 A 19:00 HORAS;19,335293265;-99,162996129
SÁBADO;5 DE MAYO ENTRE PARROQUIA Y LA FLORES;6:00 A 16:00 HORAS;19,368007084;-99,162977202
DOMINGO;MIXTECAS, TOTONACAS, IXTLIXOCHITL, MECONETZIN ENTRE IXTLIXOCHITL Y REY HUEMAN;8:00 A 19:00 HORAS;19,318081614;-99,162539549
DOMINGO;TOTONACAS ENTRE IXTLIXOCHITL SAN VICTORINO;8:00 A 19:00 HORAS;19,318081614;-99,162539549
DOMINGO;RÍO NEVA ENTRE SULLIVAN Y VILLALONGÍN “Tianguis Marqueros Río Neva”;07:00 A 17:00 HORAS;19,433213489;-99,162547075
LUNES;MATIAS ROMERO ENTRE PESTALOZZI Y HERIBERTO FRIAS;6:00 A 16:00 HORAS;19,379424539;-99,162049782
DOMINGO;JARDÍN DEL ARTE. “Bazar Jardín del Arte”;07:00 A 17:00 HORAS;19,433399606;-99,161895198
DOMINGO;JARDÍN DEL ARTE. “Bazar Jardín del Arte”;07:00 A 17:00 HORAS;19,433399606;-99,161895198
DOMINGO;CORAS Y REY MOCTESUMA ENTRE NAHUATLACAS Y CORAS;8:00 A 19:00 HORAS;19,314966378;-99,161694305
SÁBADO;PEDRO ENRIQUEZ UREÑA ENTRE PAPOLOTL Y CANAHUTLI;8:00 A 19:00 HORAS;19,335226123;-99,161568956
DOMINGO;OBRERO MUNDIAL ENTRE AMORES Y NICOLAS SAN JUAN;6:00 A 16:00 HORAS;19,401188003;-99,161448244
LUNES;PROGRESO NACIONAL ENTRE CALLE 7 Y CALLE 10;07:00 A 17:00 HORAS;19,520538491;-99,161214712
SÁBADO;MISERICORDIA;6:00 A 16:00 HORAS;19,370061150;-99,160968967
MARTES;SERAPIO RENDON ENTRE SULLIVAN Y VILLALONGÍN “Tianguis Serapio”;07:00 A 17:00 HORAS;19,432660419;-99,161016354
SÁBADO;SERAPIO RENDON ENTRE SULLIVAN Y VILLALONGÍN “Tianguis Serapio”;07:00 A 17:00 HORAS;19,432660419;-99,161016354
MARTES;MOCTEZUMA / LÁZARO CÁRDENAS Y CUAUHTÉMOC;08:00 A 19:00 HORAS;19,299160982;-99,160630426
MIÉRCOLES;TOCHTLI ENTRE AVENIDA ESCUINAPA Y QUECHOL;8:00 A 19:00 HORAS;19,329692021;-99,160650824
DOMINGO;TOCHTLI ENTRE AVENIDA ESCUINAPA Y AYOTOSCO;8:00 A 19:00 HORAS;19,329692021;-99,160650824
SÁBADO;AV. PROGRESO NACIONAL ENTRE CALLE 10 Y CALLE 9;07:00 A 17:00 HORAS;19,520321730;-99,160762624
LUNES;UXMAL ENTRE CARRILLO PUERTO Y ANTONIO GUTIERREZ NAJERA;6:00 A 16:00 HORAS;19,362181214;-99,160302503
DOMINGO;SULLIVAN ENTRE SERAPIO RENDON Y SADI CARNOT “Tianguis Monumento a la Madre”;07:00 A 17:00 HORAS;19,432751971;-99,160296274
DOMINGO;REY TOPIULZIN ENTRE ZAPOTECAS Y AV. AZTECAS;8:00 A 19:00 HORAS;19,324102097;-99,160101972
DOMINGO;AV. PROGRESO NACIONAL ENTRE CALLE 10 Y CALLE 12;07:00 A 17:00 HORAS;19,520016873;-99,160088183
LUNES;JALAPA, ENTRE CALLEJÓN DE LEÓN DE LOS ALDAMA Y ANTONIO M. ANZÁ  “Bazar Jalapa”;07:00 A 17:00 HORAS;19,411479916;-99,159695831
MARTES;JALAPA, ENTRE CALLEJÓN DE LEÓN DE LOS ALDAMA Y ANTONIO M. ANZÁ  “Bazar Jalapa”;07:00 A 17:00 HORAS;19,411479916;-99,159695831
MIÉRCOLES;JALAPA, ENTRE CALLEJÓN DE LEÓN DE LOS ALDAMA Y ANTONIO M. ANZÁ  “Bazar Jalapa”;07:00 A 17:00 HORAS;19,411479916;-99,159695831
JUEVES;JALAPA, ENTRE CALLEJÓN DE LEÓN DE LOS ALDAMA Y ANTONIO M. ANZÁ  “Bazar Jalapa”;07:00 A 17:00 HORAS;19,411479916;-99,159695831
VIERNES;JALAPA, ENTRE CALLEJÓN DE LEÓN DE LOS ALDAMA Y ANTONIO M. ANZÁ  “Bazar Jalapa”;07:00 A 17:00 HORAS;19,411479916;-99,159695831
SÁBADO;JALAPA, ENTRE CALLEJÓN DE LEÓN DE LOS ALDAMA Y ANTONIO M. ANZÁ  “Bazar Jalapa”;07:00 A 17:00 HORAS;19,411479916;-99,159695831
DOMINGO;JALAPA, ENTRE CALLEJÓN DE LEÓN DE LOS ALDAMA Y ANTONIO M. ANZÁ  “Bazar Jalapa”;07:00 A 17:00 HORAS;19,411479916;-99,159695831
SÁBADO;CALLE 10 ENTRE PROGRESO NACIONAL Y EJE CENTRAL LAZARO CARDENAS;07:00 A 17:00 HORAS;19,521821979;-99,159649234
LUNES;CALLE 12 ENTRE AV. PROGRESO NACIONAL Y CALLE 28;07:00 A 17:00 HORAS;19,520476402;-99,159281343
SÁBADO;CALLE 12 ENTRE AV. PROGRESO NACIONAL Y CALLE 28;07:00 A 17:00 HORAS;19,520476402;-99,159281343
JUEVES;RAMÓN LÓPEZ VELARDE, ENTRE  NARANJO Y JAIME TORRES BODET “Tianguis Santa María”;07:00 A 17:00 HORAS;19,444512923;-99,159171657
MIÉRCOLES;PROL. JUÁREZ CDA. DE MIRADOR 5 / MIRADOR 4 Y 5;08:00 A 19:00 HORAS;19,252931851;-99,158981040
SÁBADO;CALLE 28 ENTRE CALLE 11 Y CALLE 12;07:00 A 17:00 HORAS;19,521226897;-99,159120238
DOMINGO;PROL. JUÁREZ CDA. DE MIRADOR 5 / MIRADOR 4 Y 5;08:00 A 19:00 HORAS;19,252879822;-99,158846058
JUEVES;GLADIOLAS / RIOS SAN BUENAVENTURA;08:00 A 19:00 HORAS;19,266966330;-99,158849250
SÁBADO;RÍO SAN BUENAVENTURA  / AV. PARAISO Y BUGAMBIALIA;08:00 A 19:00 HORAS;19,267336335;-99,158728366
JUEVES;TABARETE ENTRE CORAS Y TESSNENE;8:00 A 19:00 HORAS;19,318238374;-99,158681201
JUEVES;RIO SAN BUENAVENTURA / TEPOZAN Y AVE DEL PARAISO;08:00 A 19:00 HORAS;19,268149749;-99,158464495
LUNES;PROGRESO NACIONAL ENTRE CALLE 10 Y CALLE 20;07:00 A 17:00 HORAS;19,519202150;-99,158474048
SÁBADO;AV. PROGRESO NACIONAL ENTRE CALLE 18 Y CALLE 13;07:00 A 17:00 HORAS;19,519202150;-99,158474048
SÁBADO;RÍO DE SAN BUENAVENTURA / JAZMIN Y LÁZARO CÁRDENAA;08:00 A 19:00 HORAS;19,269916737;-99,157945539
VIERNES;EJE 1 ÁLZATE, ENTRE NARANJO Y STA. MARÍA “Tianguis Naranjo”;07:00 A 17:00 HORAS;19,447081007;-99,158059894
LUNES;EJE 1 ÁLZATE, ENTRE NARANJO Y STA. MARÍA “Tianguis Naranjo”;07:00 A 17:00 HORAS;19,447081007;-99,158059894
LUNES;ORIZABA, ESQ. M. ANZÁ Y  PLAZA DEL LANZADOR,“Bazar el Lanzador”;07:00 A 17:00 HORAS;19,411539495;-99,158014947
DOMINGO;"ORIZABA, ESQ. M. ANZÁ Y  PLAZA DEL LANZADOR, CENTRO URBANO BENITO JUÁREZ ""Mercado el 100”";07:00 A 17:00 HORAS;19,411539495;-99,158014947
MIÉRCOLES;ORIZABA, ESQ. M. ANZÁ Y  PLAZA DEL LANZADOR,“Bazar el Lanzador”;07:00 A 17:00 HORAS;19,411539495;-99,158014947
JUEVES;ORIZABA, ESQ. M. ANZÁ Y  PLAZA DEL LANZADOR,“Bazar el Lanzador”;07:00 A 17:00 HORAS;19,411539495;-99,158014947
VIERNES;ORIZABA, ESQ. M. ANZÁ Y  PLAZA DEL LANZADOR,“Bazar el Lanzador”;07:00 A 17:00 HORAS;19,411539495;-99,158014947
SÁBADO;ORIZABA, ESQ. M. ANZÁ Y  PLAZA DEL LANZADOR,“Bazar el Lanzador”;07:00 A 17:00 HORAS;19,411539495;-99,158014947
DOMINGO;ORIZABA, ESQ. M. ANZÁ Y  PLAZA DEL LANZADOR,“Bazar el Lanzador”;07:00 A 17:00 HORAS;19,411539495;-99,158014947
SÁBADO;RIO SAN BUENAVENTURA / JAZMIN Y GARDENIA;08:00 A 19:00 HORAS;19,270917937;-99,157588481
JUEVES;UNIVERSIDAD ENTRE ANGEL URRAZA Y SAN BORJA;6:00 A 16:00 HORAS;19,381869261;-99,157468159
JUEVES;IZQUITECATL ENTRE TEOCALLI Y REY IXTLIXOCHITL;8:00 A 19:00 HORAS;19,317242089;-99,157229014
VIERNES;MÉRIDA ENTRE ÁLVARO OBREGÓN Y GUANAJUATO “Tianguis Merida Obregón”;07:00 A 17:00 HORAS;19,417917017;-99,157152887
DOMINGO;IXTLIXOCHITL EXP. MDO. A. MONT. ENTRE MIXTECAS Y TOLTECAS;8:00 A 19:00 HORAS;19,323978048;-99,156733956
DOMINGO;IXTLIXOCHITL ENTRE MIXTECAS Y NAHUATLACAS;8:00 A 19:00 HORAS;19,323978048;-99,156733956
MARTES;CALZADA VALLEJO ENTRE PLAYA Y MARGARITA MAZA DE JUAREZ;07:00 A 17:00 HORAS;19,503986224;-99,156791149
JUEVES;CALLE PLAYA ENTRE AV. OTHON DE MENDIZABAL Y CALZADA VALLEJO;07:00 A 17:00 HORAS;19,503986224;-99,156791149
JUEVES;LAS FLORES ENTRE REAL DE LOS REYES Y REFORMA POLITICA;8:00 A 19:00 HORAS;19,340372045;-99,155992035
DOMINGO;SAN RICARDO ENTRE SAN HERMILO Y SAN RAUL;8:00 A 19:00 HORAS;19,313162049;-99,155798959
SÁBADO;MÉRIDA, ENTRE COAHUILA Y ANTONIO M.  ANZÁ “Tianguis Meida Coahuila”;07:00 A 17:00 HORAS;19,412244760;-99,155714039
SÁBADO;EZEQUIEL MONTES, ENTRE ÉDISON Y PUENTE DE ALVARADO “Tianguis Ezequiel Montes”;07:00 A 17:00 HORAS;19,438834790;-99,155576186
LUNES;CARRETERA FEDERAL A CUERNAVACA;08:00 A 19:00 HORAS;19,209390442;-99,155357552
DOMINGO;AMERICA ENTRE SAN ANGEL DE QUEVEDO Y PACIFICO;8:00 A 19:00 HORAS;19,343185054;-99,155295971
MARTES;ING. AMICAR VIDAL / LA 5A. Y LA 7A;08:00 A 19:00 HORAS;19,292752331;-99,155174678
MARTES;ING. AMICAR VIDAL /FRAY PEDRO DE GANTÉ HASTA CALZ. DE TLALPAN;08:00 A 19:00 HORAS;19,292799603;-99,155060602
DOMINGO;CUAUHTÉMOC, ENTRE ANTONIO M. ANZÁ Y HUATABAMPO (PARQUE LÓPEZ VELARDE) “Bazar Parque Ramón López Velarde”;07:00 A 17:00 HORAS;19,409584064;-99,155125164
SÁBADO;CUAUHTÉMOC, ENTRE ANTONIO M. ANZÁ Y HUATABAMPO (PARQUE LÓPEZ VELARDE) “Bazar Parque Ramón López Velarde”;07:00 A 17:00 HORAS;19,409584064;-99,155125164
MIÉRCOLES;SAN RICARDO ENTRE SAN ALBERTO Y SAN RAUL;8:00 A 19:00 HORAS;19,316139486;-99,154746471
JUEVES;VERTIZ ENTRE MIGUEL LAURENT Y MUNICIPIO  LIBRE;6:00 A 16:00 HORAS;19,373505343;-99,154515253
DOMINGO;"PARQUE PUSHKIN MORELIA, COLIMA, ÁLVARO OBREGÓN Y CUAUHTÉMOC ""Tianguis Parque Puskin""";07:00 A 17:00 HORAS;19,420158822;-99,154276963
DOMINGO;CORAS ENTRE NEZAHUALCOYOTL E IXTLIXOCHITL;8:00 A 19:00 HORAS;19,322941255;-99,154009767
SÁBADO;AV. CUAUHTÉMOC, ENTRE DR. LICEAGA Y DR. NAVARRO;07:00 A 17:00 HORAS;19,421894141;-99,153972262
SÁBADO;MARGARITA MAZA DE JUAREZ ENTRE EJE CENTRAL LAZARO CARDENAS Y CALZADA VALLEJO;07:00 A 17:00 HORAS;19,507529124;-99,153982894
JUEVES;CUMBRES DE MALTRATAENTRE XOCHICALCO Y VERTIZ;6:00 A 16:00 HORAS;19,393852916;-99,153720255
SÁBADO;PONIENTE 148 ENTRE NORTE 35 Y CALZADA VALLEJO;07:00 A 17:00 HORAS;19,500015258;-99,153671396
SÁBADO;CAMPECHE ENTRE AV. EDO. DE México Y TLAXCALA;07:00 A 17:00 HORAS;19,554059849;-99,153396757
MARTES;ANTIGUA TAXQUEÑA ENTRE AMERICA Y SAN LUCAS;8:00 A 19:00 HORAS;19,345273080;-99,153108978
VIERNES;ACULCO ENTRE CIENEGA Y PLAZUELA DE LOS REYES;8:00 A 19:00 HORAS;19,337377107;-99,153076006
MARTES;SANTA URSULA ENTRE SAN CASTULO Y SAN EMETERINO;8:00 A 19:00 HORAS;19,308799855;-99,152966772
LUNES;REPUBLICAS ENTRE SEVILLA Y TOKIO;6:00 A 16:00 HORAS;19,364438436;-99,152977841
VIERNES;CIENEGA ENTRE ACOLCO;8:00 A 19:00 HORAS;19,337223945;-99,152835089
DOMINGO;DR. ERAZO ENTRE DR. CARMONA Y VALLE Y DR. LUCIO “Tianguis Erazo”;07:00 A 17:00 HORAS;19,418530659;-99,152901887
LUNES;AMERICA ENTRE PENSYLVANIA Y ANTIGUA TAXQUEÑA;8:00 A 19:00 HORAS;19,346254118;-99,152742000
MIÉRCOLES;CALZ SAN SIMÓN, ENTRE CHOPO Y OYAMEL, “Tianguis San Simón”;07:00 A 17:00 HORAS;19,459822232;-99,152333925
MARTES;SAN BENJAMIN ENTRE SAN CASTULO Y SAN JORGE;8:00 A 19:00 HORAS;19,306837048;-99,152081036
MARTES;SAN GABRIEL ENTRE SANTA URSULA Y SAN HERMILIO;8:00 A 19:00 HORAS;19,309557338;-99,152027199
MARTES;SAN GABRIEL ENTRE SANTA URSULA Y SAN HERMILIO;8:00 A 19:00 HORAS;19,309557338;-99,152027199
MIÉRCOLES;VERTIZ Y CONCEPCION;6:00 A 16:00 HORAS;19,386435158;-99,152061083
DOMINGO;SAN GONZALO ENTRE SAN BENITO Y SAN ALBERTO;8:00 A 19:00 HORAS;19,311863057;-99,151786975
DOMINGO;SAN GONZALO ENTRE SAN BENITO Y SAN MACARIO;8:00 A 19:00 HORAS;19,311863057;-99,151786975
DOMINGO;SAN GONZALO ENTRE SAN BENITO Y SAN GABRIEL;8:00 A 19:00 HORAS;19,311796120;-99,151533992
LUNES;CALLE 29 ENTRE CALLE 26 Y CALLE 23-A;07:00 A 17:00 HORAS;19,519271572;-99,151602270
LUNES;AV. SAN MIGUEL CHALMA ENTRE PUEBLA Y NAYARIT;07:00 A 17:00 HORAS;19,551545830;-99,151558035
MIÉRCOLES;SARATOGA Y EMPERADORES;6:00 A 16:00 HORAS;19,366943095;-99,151282839
MARTES;CALLE SANTA URSULA ENTRE SAN CASTULO, SAN LEON Y AVENIDA DEL IMAN;8:00 A 19:00 HORAS;19,308046126;-99,150591981
MIÉRCOLES;ZARAGOZA, ENTRE PUENTE DE ALVARADO Y OROZCO Y BERRA, “Tianguis Zaragoza”;07:00 A 17:00 HORAS;19,438901877;-99,150611458
SÁBADO;BOULEVAR DEL TEMOLUCO ENTRE DESEMBOCADURA E INSULA;07:00 A 17:00 HORAS;19,525263672;-99,149951764
SÁBADO;BOULEVAR DEL TEMOLUCO ENTRE ANDADOR 33 Y LA AV. INSULA;07:00 A 17:00 HORAS;19,525263672;-99,149951764
SÁBADO;BOULEVAR DEL TEMOLUCO ENTRE ANDADOR 8 Y DESOMBOCADURA;07:00 A 17:00 HORAS;19,525263672;-99,149951764
VIERNES;SAN JUAN BOSCO / ACUEDUCTO Y RESPALDO DE SAN LORENZO;08:00 A 19:00 HORAS;19,297530322;-99,149734096
LUNES;SAN JUAN BOSCO / ACUEDUCTO Y RESPALDO DE SAN LORENZO;08:00 A 19:00 HORAS;19,297489315;-99,149705979
JUEVES;GERANIO, ENTRE NOPAL Y LIRIO.  “Tianguis Peñafiel”;07:00 A 17:00 HORAS;19,457941146;-99,149718669
DOMINGO;DR. NAVARRO ENTRE NIÑOS HÉROES Y DR. JIMENEZ “Tianguis Navarro”;07:00 A 17:00 HORAS;19,420636100;-99,149387569
DOMINGO;EXPLANADA MERCADO MORELIA DR. VERTIZ Y FEDERICO GOMEZ SANTOS “Tianguis Mercado Morelia”;07:00 A 17:00 HORAS;19,408127880;-99,149311948
MIÉRCOLES;LEY FED. DEL TRABAJO / LEY DE LA REFORMA AGRARIA Y LEY REFORMA DE TURISMO;08:00 A 19:00 HORAS;19,239731492;-99,149145357
MARTES;DIAGONAL SAN ANTONIO ENTRE MITLA Y ZEMPOALA;6:00 A 16:00 HORAS;19,399983085;-99,149263181
JUEVES;PONIENTE 126 ENTRE NORTE 19-A Y NORTE 22-A;07:00 A 17:00 HORAS;19,486598508;-99,148668952
SÁBADO;(INT. CONCERT. PORVENIR) CALLE 26 Y 9;8:00 A 19:00 HORAS;19,471814392;-99,148554941
MARTES;MIRADOR CHAPULTEPEC / DEPTO. DE AGUS Y TETEQUILO;08:00 A 19:00 HORAS;19,203606642;-99,148161014
SÁBADO;DR. VELASCO, ENTRE DR.VERTIZ Y DR. JIMÉNEZ;07:00 A 17:00 HORAS;19,419247047;-99,148318325
LUNES;BULEVAR DE TEMOLUCO ENTRE ANDADOR 13 Y ANDADOR 18;07:00 A 17:00 HORAS;19,524706198;-99,148385138
JUEVES;BULEVAR DE TEMOLUCO ENTRE ANDADOR 14 Y ANDADOR 19;07:00 A 17:00 HORAS;19,524706198;-99,148385138
DOMINGO;CALLEJÓN DE PANAMÁ, ENTRE DR. NORMA Y DR. JOSÉ MARÍA VERTIZ “Tianguis Doctores Titino”;07:00 A 17:00 HORAS;19,409848294;-99,148108163
MARTES;SÁNDALO ESQ. TILOS “Tianguis Sándalo”;07:00 A 17:00 HORAS;19,462381304;-99,147960960
VIERNES;SÁNDALO ESQ. TILOS “Tianguis Sándalo”;07:00 A 17:00 HORAS;19,462381304;-99,147960960
DOMINGO;PLAZUELA EMILIANO ZAPATA ENTRE SANTA CRUZ Y CERRADA SANTA CRUZ;8:00 A 19:00 HORAS;19,329366067;-99,147578038
