DÍA;Ubic;Horario;Latitude;Longitude
LUNES;CAMPESINOS ENTRE LEANDRO VALLE Y JUÁREZ;8:00 A 16:00 HORAS;19,329368498;-99,326824648
LUNES;PORFIRIO DÍAZ ENTRE REFORMA E INDEPENDENCIA;8:00 A 16:00 HORAS;19,352164304;-99,315436951
MIÉRCOLES;JUÁREZ PONIENTE ENTRE AV. MÉXICO Y 12 DE DICIEMBRE;8:00 A 16:00 HORAS;19,361677076;-99,301783483
VIERNES;CAMINO PANORAMICO KM 28.5 DE CALZADA DESIERTO DE LOS LEONES;8:00 A 17:00 HORAS;19,318444744;-99,296058346
DOMINGO;AHUEHUETES ENTRE AV. SAN JOSÉ DE LOS CEDROS Y MONTE REAL;8:00 A 16:00 HORAS;19,365957966;-99,290250280
MIÉRCOLES;SAUCE, ROBLE MADROÑO ENTRE AV. SAN JOSÉ DE LOS CEDROS Y JACARANDAS;8:00 A 16:00 HORAS;19,371402755;-99,289091517
DOMINGO;PROLONGACIÓN JUÁREZ Y JUSTO SIERRA;8:00 A 16:00 HORAS;19,352415995;-99,288275306
JUEVES;ANTONIO GUTIÉRREZ ENTRE OCOTOLA Y CELESTINO PÉREZ;8:00 A 16:00 HORAS;19,360828080;-99,287451977
DOMINGO;FRAY BARTOLOME DE LAS CASAS ESQ. DESIERTO DE LOS LEONES;8:00 A 17:00 HORAS;19,328012340;-99,285359791
SÁBADO;25 DE DICIEMBRE ENTRE PASTORES Y MELCHOR;8:00 A 16:00 HORAS;19,375046339;-99,283664705
MARTES;RAFAEL CHECA Y DESIERTO DE LOS LEONES;8:00 A 17:00 HORAS;19,326813701;-99,282733870
VIERNES;MINA, ALDAMA Y ABASOLO;8:00 A 16:00 HORAS;19,342559548;-99,281372396
DOMINGO;SAN DIEGO Y ALDAMA PLAZA HIDALGO;8:00 A 17:00 HORAS;19,328479945;-99,272286687
JUEVES;SAN DIEGO ENTRE ALDAMA Y PLAZA HIDALGO;8:00 A 17:00 HORAS;19,328555321;-99,271672112
MARTES;ARBOLEDAS ESQ CON AV 29 DE OCTUBRE;8:00 A 17:00 HORAS;19,309689163;-99,270932618
LUNES;CDA. CAPULIN ENT. 14 DE FEBRERO Y AV. 29 DE OCT.;8:00 A 17:00 HORAS;19,311670131;-99,269138093
DOMINGO;AZUCENA Y JAZMIN;8:00 A 17:00 HORAS;19,317038314;-99,268451128
SÁBADO;NICOLAS FERNANDEZ Y EMILIANO ZAPATA;8:00 A 17:00 HORAS;19,317319300;-99,266462612
SÁBADO;PROL. VASCO DE QUIROGA (BAJO PUENTES DE SANTA FE);8:00 A 17:00 HORAS;19,366143963;-99,266338127
MIÉRCOLES;FRANCISCO VILLA Y EMILIANO ZAPATA;8:00 A 17:00 HORAS;19,320823949;-99,264552646
SÁBADO;FRANCISCO VILLA Y EMILIANO ZAPATA;8:00 A 17:00 HORAS;19,320832158;-99,264506076
DOMINGO;AVENIDA OJO DE AGUA S/N;07:00 A 17:00 HORAS;19,309155025;-99,263592770
MIÉRCOLES;AVENIDA OJO DE AGUA S/N;07:00 A 17:00 HORAS;19,309155025;-99,263592770
VIERNES;LAZARO CARDENAS ENTRE JAZMIN Y AV 29 DE OCTUBRE;8:00 A 17:00 HORAS;19,320242049;-99,262818713
SÁBADO;MINAS DE CENTENO Y COCONETLA;07:00 A 17:00 HORAS;19,297594955;-99,262017653
SÁBADO;MINAS DE CENTENO Y COCONETLA,;07:00 A 17:00 HORAS;19,297594955;-99,262017653
DOMINGO;ALCANFORES ENT DEL TRABAJO Y AV. 29 DE OCTUBRE;8:00 A 17:00 HORAS;19,323327989;-99,260200562
JUEVES;AV MEXICO 68 Y COLORINES;8:00 A 17:00 HORAS;19,320995780;-99,259143823
MARTES;AV. STIM ENTRE BOSQUES DE CACAOS Y FABRICA DE ARMAS;8:00 A 16:00 HORAS;19,399811028;-99,256920327
JUEVES;CALLE CORNEJAL Y MIQUIHUANA;07:00 A 17:00 HORAS;19,315931884;-99,256708758
LUNES;CALLE CORNEJAL Y MIQUIHUANA;07:00 A 17:00 HORAS;19,315931884;-99,256708758
LUNES;ZARAGOZA ENTRE ALTO LERMA Y AV. TAMAULIPAS;8:00 A 17:00 HORAS;19,355211376;-99,256532020
VIERNES;ALTA TENSION Y FLOR DEL CAMPO;8:00 A 17:00 HORAS;19,328582718;-99,255328023
MIÉRCOLES;COMONFORT, CORREGIDORA ENTRE RAYON Y GUADALUPE VICTORIA;8:00 A 17:00 HORAS;19,357299738;-99,253646027
MARTES;AV CENTENARIO ESQ CLAVEL;8:00 A 17:00 HORAS;19,329941288;-99,252485060
LUNES;CALZ. DE LAS AGUILAS ENT. AGAMENON E ILIADA;8:00 A 17:00 HORAS;19,340147082;-99,252277468
MARTES;ORQUIDEA Y AV DE LAS TORRRES;8:00 A 17:00 HORAS;19,329397676;-99,249406476
DOMINGO;CALLE HUAYATLA.;07:00 A 17:00 HORAS;19,305253338;-99,248591275
VIERNES;MOCTEZUMA ESQ. MELCHOR OCAMPO;8:00 A 17:00 HORAS;19,357692627;-99,248428896
LUNES;PASEO DE LAS LILAS ENTRE CARRETERA MÉXICO TOLUCA Y BOSQUES DE PALMITOS;8:00 A 16:00 HORAS;19,390318804;-99,248313952
DOMINGO;SANTA ANITA ENTRE TAMAULIPAS Y SAN FRANCISCO;8:00 A 17:00 HORAS;19,361690511;-99,247667960
LUNES;CALLE AZUCENA;07:00 A 17:00 HORAS;19,310834408;-99,247338068
MARTES;AVENIDA DE LAS TORRES;07:00 A 17:00 HORAS;19,323200610;-99,247337345
JUEVES;JAZMIN Y AV DE LAS TORRES;8:00 A 17:00 HORAS;19,330363626;-99,246886956
LUNES;RIO BRAVO ESQ. RIO MIXCOAC;8:00 A 17:00 HORAS;19,356455281;-99,246151448
DOMINGO;CALLE INDEPENDENCIA;07:00 A 17:00 HORAS;19,297235113;-99,245347370
JUEVES;CALLE INDEPENDENCIA;07:00 A 17:00 HORAS;19,297235113;-99,245347370
MARTES;CALLE INDEPENDENCIA;07:00 A 17:00 HORAS;19,297235113;-99,245347370
DOMINGO;AV DE LOS TANQUES ESQ ALLENDE;8:00 A 17:00 HORAS;19,330436692;-99,244992921
SÁBADO;AV DE LOS TANQUES ESQ ALLENDE;8:00 A 17:00 HORAS;19,330722537;-99,244830009
SÁBADO;CALLE VIOLETA,;07:00 A 17:00 HORAS;19,311998077;-99,243827969
DOMINGO;AV JALALPA CDA. CHALAHUITLE Y COLIPA 3;8:00 A 17:00 HORAS;19,366767750;-99,243281924
JUEVES;CALLE HORTENCIA;07:00 A 17:00 HORAS;19,315723917;-99,243130689
SÁBADO;AVENIDA LUIS CABRERA,;07:00 A 17:00 HORAS;19,321724195;-99,242620459
DOMINGO;JOSE MARIA JAURIETA ENTRE NICOLAS FEERNANDEZ Y ANTONIO RUIZ;8:00 A 17:00 HORAS;19,357343735;-99,241923414
MARTES;F.F.C.C. DE CUERNAVACA / KAHUA Y TEPOZANES;08:00 A 19:00 HORAS;19,277096769;-99,240992662
SÁBADO;DZEMUL / HOCABA Y HUI;08:00 A 19:00 HORAS;19,276244892;-99,240867886
MIÉRCOLES;BOSQUES / POTRERITO Y REGADERA;08:00 A 19:00 HORAS;19,270138456;-99,240788541
SÁBADO;AV. CENTENARIO ENTRE CALLE 1 Y JOSE MARIA HEREDIA;8:00 A 17:00 HORAS;19,354370958;-99,240628364
VIERNES;AV. XICOMECATL ENTRE COLUMBUS Y MORELOS;8:00 A 17:00 HORAS;19,361691511;-99,240616404
LUNES;CALLE LAS TORRES Y ANTONIO MACHADO;8:00 A 17:00 HORAS;19,355768316;-99,240129400
SÁBADO;FORTIN ENTRE PERAL Y AV. GUSTAVO DIAZ ORDAZ;8:00 A 17:00 HORAS;19,371888485;-99,239113891
JUEVES;CDA DEL ROSAL ENTRE AVENIDA DEL ROSAL Y PTA CEHUAYO;8:00 A 17:00 HORAS;19,356816172;-99,239009451
JUEVES;FORTIN ENTRE PERAL Y AV. GUSTAVO DIAZ ORDAZ;8:00 A 17:00 HORAS;19,371431009;-99,238880889
SÁBADO;MANI / SINANCHE Y POLOLNA;08:00 A 19:00 HORAS;19,292225666;-99,237873327
JUEVES;MANI / HOMUN Y SISAL;08:00 A 19:00 HORAS;19,283648715;-99,237434562
DOMINGO;HOMUN / MANI Y TIXCANDAL;08:00 A 19:00 HORAS;19,283747308;-99,237159556
DOMINGO;HOCABA / MANI Y TETIZ, SOTUTA / HOCABA Y TEKAL;08:00 A 19:00 HORAS;19,281419790;-99,236981469
SÁBADO;BOSQUES / CERO DE LAS PALMAS Y PLAN DE LA MAQUINA;08:00 A 19:00 HORAS;19,270131732;-99,236873499
LUNES;FRESNOS /FRESNOS Y AV. BOSQUES;08:00 A 19:00 HORAS;19,269991963;-99,236144899
VIERNES;POLVORA ENT. SERPIENTE Y AV. VASCO DE QUIROGA;8:00 A 17:00 HORAS;19,382310739;-99,236283318
DOMINGO;AV CENTENARIO ENTRE LA PRINCIPAL Y EL QUESO;8:00 A 17:00 HORAS;19,355652322;-99,236159369
MARTES;CHUBURNA / DZEMUL Y HOCABA;08:00 A 19:00 HORAS;19,278773074;-99,236032710
MIÉRCOLES;AV. CENTENARIO Y BELEN DE LAS FLORES;8:00 A 17:00 HORAS;19,354723329;-99,235688425
MIÉRCOLES;EUCALIPTO ENTRE AV. SANTA LUCIA Y PTO TAMPICO;8:00 A 17:00 HORAS;19,366982238;-99,235699864
SÁBADO;GUAJIRA Y TAPUYAS;8:00 A 17:00 HORAS;19,353577739;-99,235513314
LUNES;POLVORA ENTRE PINO Y VASCO DE QUIROGA;8:00 A 17:00 HORAS;19,382543437;-99,235152859
SÁBADO;PUERTO TACALA ENTRE STA LUCIA Y PTO PEÃ‘ASCO;8:00 A 17:00 HORAS;19,366253635;-99,234183202
MARTES;HILARIO SALGUERA Y LOPEZ VELARDE;8:00 A 17:00 HORAS;19,379742191;-99,233739898
VIERNES;CALLE FRANCISCO SARABIA, ALFONSO PRIANNI, COAHUILA, MORELIA, EMILIANO ZAPATA Y TOLUCA;07:00 A 17:00 HORAS;19,305983091;-99,233402968
DOMINGO;CALLE FRANCISCO SARABIA,;07:00 A 17:00 HORAS;19,306499311;-99,232972789
DOMINGO;HOMUN / TETIZ Y MANI;08:00 A 19:00 HORAS;19,283971660;-99,232838696
DOMINGO;ANDADOR 1 Y 2 AV GUSTAVO DIAZ ORDAZ;8:00 A 17:00 HORAS;19,375718288;-99,232310337
MIÉRCOLES;ANDADOR 2 Y AV GUSTAVO DIAZ ORDAZ;8:00 A 17:00 HORAS;19,376164765;-99,232245336
JUEVES;CALLE DEL POZO, FLORES Y AV DESIERTO DE LOS LEONES;8:00 A 17:00 HORAS;19,340450045;-99,232119288
VIERNES;CALLE FRANCISCO SARABIA, ALFONSO PRIANNI, COAHUILA, MORELIA, EMILIANO ZAPATA Y TOLUCA;07:00 A 17:00 HORAS;19,307307849;-99,231933250
MIÉRCOLES;CANSHACAB, HALACHO / BOKOBA, TETIZ, PANABA, HALACHO Y TENOSIQUE;08:00 A 19:00 HORAS;19,287030277;-99,231758682
VIERNES;TIZMEHUAC / TETIZ Y SUDZAL;08:00 A 19:00 HORAS;19,278481842;-99,231691744
DOMINGO;PANABA, TOSKOKOB Y HOMUN / TETIZ Y CHICOASEN;08:00 A 19:00 HORAS;19,284191586;-99,231664083
JUEVES;DURAZNO / PIEDRA TRONADA Y TIJERA;08:00 A 19:00 HORAS;19,272785072;-99,230748905
SÁBADO;DURAZNO / PIEDRA TRONADA Y TIJERA;08:00 A 19:00 HORAS;19,272785072;-99,230748905
MIÉRCOLES;CALLE PRESILLA Y PAPANTLA;07:00 A 17:00 HORAS;19,316932191;-99,230541010
LUNES;BOKOBA / POMUCH Y CANSAACAB;08:00 A 19:00 HORAS;19,296997578;-99,230315958
VIERNES;AV GUSTAVO DIAZ ORDAZ ENTRE NICOLAS BRAVO Y HNOS GALEANA;8:00 A 17:00 HORAS;19,377471697;-99,229884318
SÁBADO;CHICOASEN / TIZIMIN Y ACANCEH-;08:00 A 19:00 HORAS;19,289349112;-99,229729629
VIERNES;AV. GUSTAVO DIAZ ORDAZ ENTRE PUERTO VILLA Y PTO CARRANZA;8:00 A 17:00 HORAS;19,370573053;-99,228748809
MIÉRCOLES;SOLEDAD ENTRE RECUERDO Y DESIERTO DE LOS LEONES;8:00 A 17:00 HORAS;19,340812056;-99,228648350
DOMINGO;VENUNCIA ESQ. AVENIDA BOSQUES;08:00 A 19:00 HORAS;19,266313703;-99,228143019
MARTES;RIO GUADALUPE Y RIO BALSAS;8:00 A 17:00 HORAS;19,344661607;-99,227183349
SÁBADO;SACALUM / TIXPEHUATL Y TIXKIKOB;08:00 A 19:00 HORAS;19,279059750;-99,227036308
JUEVES;SIERRA TARAHUMARA ENTRE SIERRA PARACAIMA  Y SIERRA LEONA;07:00 A 17:00 HORAS;19,413960004;-99,227105602
JUEVES;LUIS G URBINA ENTRE ANTONIO Y PASO DE LA NIEVE;8:00 A 17:00 HORAS;19,380738529;-99,226956294
JUEVES;AV. TOLUCA Y SAN AGUSTIN;8:00 A 17:00 HORAS;19,336840601;-99,226747326
MARTES;JOSE GALVEZ Y AVENIDA CENTENARIO;8:00 A 17:00 HORAS;19,359079645;-99,226728794
LUNES;SAN AGUSTIN Y SAN PEDRO;8:00 A 17:00 HORAS;19,336332817;-99,226583794
LUNES;FRANCISCO BOCANEGRA ENT. CALLE CAÃ‘ADA Y PASO SANTA ISABEL;8:00 A 17:00 HORAS;19,381588985;-99,226207788
LUNES;CALLE JALISCO;07:00 A 17:00 HORAS;19,313693752;-99,225848590
DOMINGO;AURORA ENTRE DEL MORAL Y DESIERTO DE LOS LEONES;8:00 A 17:00 HORAS;19,341026075;-99,225353284
MIÉRCOLES;AV TOLUCA ENTRE SAN JUAN Y SEMINARIO;8:00 A 17:00 HORAS;19,336641801;-99,225152783
MARTES;CAÑADA REAL Y CAÑADA ROSQUIN;8:00 A 17:00 HORAS;19,381897969;-99,225045779
JUEVES;LABNA / IZAMAL Y YOBAIN;08:00 A 19:00 HORAS;19,301740288;-99,224653515
DOMINGO;3RA. CERRADA DE BAHIA ENTRE PINO Y LAS AGUILAS;8:00 A 17:00 HORAS;19,348298200;-99,223282267
MIÉRCOLES;3RA. CERRADA DE BAHIA ENTRE PINO Y LAS AGUILAS;8:00 A 17:00 HORAS;19,347996715;-99,223278267
MIÉRCOLES;3RA. DE BAHIA, JACARANDAS Y CALZADA DE LAS AGUILAS;8:00 A 17:00 HORAS;19,348856171;-99,223275247
MARTES;YOBAIN / HECELCHACAN Y DZIBALCHEN HASTA HOPERCHEN;08:00 A 19:00 HORAS;19,277642501;-99,223156068
DOMINGO;CALLE MORELOS;07:00 A 17:00 HORAS;19,326394069;-99,222692023
SÁBADO;COLINA ENT. CDA. DE GUADALUPE Y RETORNO DE COLINA;8:00 A 17:00 HORAS;19,345406849;-99,222712763
JUEVES;TENOSIQUE / CONTOY Y HOPELCHEN;08:00 A 19:00 HORAS;19,286334396;-99,222086459
VIERNES;SIERRA SANTA ROSA ENTRE CALLE 14 Y CALLE 14 BIS.;07:00 A 17:00 HORAS;19,429856000;-99,222149754
LUNES;ADOLFO DE LA HUERTA ENTRE RUIZ CORTINEZ Y BENITO JUAREZ;8:00 A 17:00 HORAS;19,375611793;-99,221648253
LUNES;LLANURA ENTRE BAHIA Y ESCOLLO;8:00 A 17:00 HORAS;19,349156155;-99,221263751
DOMINGO;ADOLFO DE LA HUERTA ENTRE ALVARO OBREGON Y ADOLFO RUIZ CORTINEZ;8:00 A 17:00 HORAS;19,375845971;-99,221284210
DOMINGO;HALACHO / CONTOY Y CALKINI;08:00 A 19:00 HORAS;19,287793584;-99,220879117
DOMINGO;AV SANTA LUCIA ENTRE CALLE 30 CALLE 34;8:00 A 17:00 HORAS;19,368044682;-99,220749246
MIÉRCOLES;LERDO DE TEJADA Y MANUEL AVILA CAMACHO;8:00 A 17:00 HORAS;19,375898608;-99,219493246
JUEVES;HUEHUETAN / TENOSIQUE Y HALACHO;08:00 A 19:00 HORAS;19,287209191;-99,218959016
LUNES;CALKINI / TIZIMIN HASTA HUEHUETAN;08:00 A 19:00 HORAS;19,289450982;-99,218819992
SÁBADO;AV MEXICO ESQUINA GUANAJUATO;8:00 A 17:00 HORAS;19,380997935;-99,218897411
SÁBADO;U.H. EMILIO PORTES GIL INTERIOR DE LA UNIDAD;08:00 A 19:00 HORAS;19,305774681;-99,218668547
MIÉRCOLES;U.H. EMILIO PORTES GIL INTERIOR DE LA UNIDAD;08:00 A 19:00 HORAS;19,305853088;-99,218397750
DOMINGO;TRANSMISIONES / U.H. EMILIO PORTES  GIL Y PERIFERICO;08:00 A 19:00 HORAS;19,306456666;-99,218268431
SÁBADO;AV. TACAMACHALCO ENTRE CALLE 6 Y CALLE 4;07:00 A 17:00 HORAS;19,430086925;-99,217426277
MARTES;ING. MILITARES ENTRE PRESA SALINILLAS Y LOMAS DE SOTELO;07:00 A 17:00 HORAS;19,444870513;-99,217361074
DOMINGO;CARRETERA PICACHO AJUSCO / JACARANDA Y ENCINO;08:00 A 19:00 HORAS;19,269020228;-99,216690754
MIÉRCOLES;GRAL. CONDE Y PALOMAS ENTRE CALLE 1 Y CALLE 9;07:00 A 17:00 HORAS;19,432962129;-99,216732796
LUNES;BOSQUES DE VIENA / HECELCHACAN Y CONTOY;08:00 A 19:00 HORAS;19,273955644;-99,216522798
JUEVES;JOSE CARDEL, E. AÑORVE HASTA H. GALEANA Y CALZ DE LA NARANJA;8:00 A 19:00 HORAS;19,474422134;-99,216726886
VIERNES;PICHUCALCO / TIXCOCOB, DZIBALCHEN, CHAPULTENANGO Y MAXCANU;08:00 A 19:00 HORAS;19,278840775;-99,216384080
MARTES;PRESA SALINILLAS ENTRE ING. MILITARES Y LOMAS DE SOTELO;07:00 A 17:00 HORAS;19,444706093;-99,216331015
MARTES;PRESA SALINILLAS ENTRE CALLE TEPUXTEPEC Y PRESA SALINILLAS;07:00 A 17:00 HORAS;19,444706093;-99,216331015
SÁBADO;PRESA SALINILLAS ENTRE LOMAS DE SOTELO E ING. MILITARES;07:00 A 17:00 HORAS;19,444706093;-99,216331015
LUNES;CALLE 6 ENTRE CALZADA AL DESIERTO DE LOS LEONES Y CALLE 2;8:00 A 17:00 HORAS;19,341839132;-99,215992710
DOMINGO;MARCO POLO Y VILLALOBOS;8:00 A 17:00 HORAS;19,378915112;-99,215901207
JUEVES;ROMULO O'FARRIL Y AMPLICACION LAS AGUILAS;8:00 A 17:00 HORAS;19,354121399;-99,215126703
JUEVES;AV ROMULO O'FARRIL Y CALZ DE LAS AGUILAS, PARQUE ECOL JAPON;8:00 A 17:00 HORAS;19,354294490;-99,215119702
SÁBADO;AV ROMULO O'FARRIL Y CALZ DE LAS AGUILAS, PARQUE ECOL JAPON;8:00 A 17:00 HORAS;19,354209495;-99,215027702
MARTES;RIO SAN BORJA Y AND. PRINCIPAL;8:00 A 17:00 HORAS;19,375740386;-99,215008700
JUEVES;CALZADA LA NARANJA DESDE HERMENEGILDO GALEANA, CALZADA SANTIAGO AHUIZOTLA,DANDO VUELTA SOBRE EMILIO CARRANZA, GUSTAVO BAZZAN, FRANCISCO VILLA Y CALLE JOSE CARDEL;8:00 A 19:00 HORAS;19,473388983;-99,215000679
SÁBADO;SIERRA MOJADA;07:00 A 17:00 HORAS;19,430219756;-99,214324061
MIÉRCOLES;POLVORA ENTRE HOLANDESES E ITALIANOS;8:00 A 17:00 HORAS;19,390705515;-99,213901190
DOMINGO;(INT.DEL MERCADO PROVIDENCIA)  LUCIO BLANCO Y VENUSTIANO CARRANZA;8:00 A 17:00 HORAS;19,491531696;-99,213642466
MARTES;INT.MERCADO PROVIDENCIA, LUCIO BLANCO Y V. CARRANZA;8:00 A 19:00 HORAS;19,491531696;-99,213642466
LUNES;ERNESTO P. URUCHURTU ENT. AV. SANTA LUCIA E HIDALGO;8:00 A 17:00 HORAS;19,370776611;-99,213482558
LUNES;ERNESTO P. URUCHURTU ENTRE AV. SANTA LUCIA Y PADRE HIDALGO;8:00 A 17:00 HORAS;19,370907034;-99,213468688
DOMINGO;AV. MEXICANOS ENT. CUBANOS Y MDO. BONANZA;8:00 A 17:00 HORAS;19,385881763;-99,213374187
LUNES;AV. MEXICANOS ENT. BRASILEÃ‘OS Y URUGUAYOS;8:00 A 17:00 HORAS;19,385971759;-99,212967683
LUNES;CALLE 6 ENTRE DESIERTO DE LOS LEONES Y CALLE 2;8:00 A 17:00 HORAS;19,343012472;-99,212423182
DOMINGO;CALLE 6 ENTRE CALE 2 Y 3;8:00 A 17:00 HORAS;19,342982063;-99,212401542
LUNES;AVENIDA MEXICANOS ENTRE URUGUAYOS Y BOLIVIANOS;8:00 A 17:00 HORAS;19,386098252;-99,211856175
MARTES;TRANSMISIONES / CALLE 7 CALLE 9;08:00 A 19:00 HORAS;19,275365891;-99,210831540
LUNES;AVENIDA MEXICANOS, BRASILEÃ‘OS Y CHILENOS;8:00 A 17:00 HORAS;19,386417736;-99,210963148
MARTES;SAN MARCOS, ENTRE POLVORA Y DOMINICANOS;8:00 A 17:00 HORAS;19,392121322;-99,210705705
DOMINGO;AVENIDA OBSERVATORIO BIZNAGA Y HENEQUEN;8:00 A 17:00 HORAS;19,398696303;-99,210390362
MARTES;JAIME BALMES ENTRE EJERCITO NACIONAL Y HOMERO;07:00 A 17:00 HORAS;19,437649785;-99,210074873
DOMINGO;PADRE HIDALGO Y EL ARBOL;8:00 A 17:00 HORAS;19,375372604;-99,209883270
MIÉRCOLES;PADRE HIDALGO Y ARBOL;8:00 A 17:00 HORAS;19,375269870;-99,209851689
SÁBADO;CALZADA DE LAS AGUILAS ENTRE RIVERA Y GUTIERREZ ZAMORA;8:00 A 17:00 HORAS;19,357919713;-99,209791160
MIÉRCOLES;HERREROS, ESQ. CALZ. DE LAS ARMAS NORTE;8:00 A 19:00 HORAS;19,510537726;-99,209845459
MARTES;AV. TRANSMISIONES ENT. SALVATIERRA Y AV. TOLUCA;8:00 A 17:00 HORAS;19,340602096;-99,209420658
SÁBADO;RIO SAN BORJA Y AVENIDA CAPULA;8:00 A 17:00 HORAS;19,379201177;-99,209190704
LUNES;AV. CHICAGO ENTRE URANO Y JUPITER;8:00 A 17:00 HORAS;19,381123008;-99,209120653
SÁBADO;BENITO JUÁREZ / LÁZAROI CÁRDENAS Y JESÚS LECUONA;08:00 A 19:00 HORAS;19,282622210;-99,208987705
MARTES;BENITO JUÁREZ / LÁZARO CÁRDENAS Y JESÚS LECUONA;08:00 A 19:00 HORAS;19,282188448;-99,208881608
DOMINGO;BENITO JUÁREZ / LÁZAROI CÁRDENAS Y JESÚS LECUONA;08:00 A 19:00 HORAS;19,281882456;-99,208711812
MARTES;HERREROS, ENTRE GEOGRAFIA Y GEOLOGIA;8:00 A 19:00 HORAS;19,511347509;-99,208781741
VIERNES;HERREROS, ENTRE CIBERNETICA Y GEOLOGIA;8:00 A 19:00 HORAS;19,511347509;-99,208781741
VIERNES;ACANTO / CARRETERA PANORAMICA PICACHO AJUSCO Y CDA. DE CARDOS;08:00 A 19:00 HORAS;19,275487669;-99,208349493
MIÉRCOLES;RIO SAN BORJA Y AVENIDA CAPULA;8:00 A 17:00 HORAS;19,379610586;-99,208394648
JUEVES;CALLE 21 ENTRE CALLE 10 Y 13;8:00 A 17:00 HORAS;19,373061243;-99,208097186
MARTES;BARRANCA HONDA ENTRE QUERETARO Y DEL RIO;8:00 A 17:00 HORAS;19,336249820;-99,207606154
DOMINGO;DUNA, CALZADA DE LAS AGUILAS Y CERRADA DE LAS AGUILAS;8:00 A 17:00 HORAS;19,358918122;-99,207595993
JUEVES;ACAMBARO ENTRE SALVATIERRA Y VERACRUZ;8:00 A 17:00 HORAS;19,341187565;-99,207266141
SÁBADO;AV 5 DE MAYO No.62, EX MODULO 15 RTP;8:00 A 17:00 HORAS;19,364193880;-99,207032638
DOMINGO;PLAZA ETIOPIA, SOBRE HERREROS;8:00 A 19:00 HORAS;19,511662631;-99,206579611
JUEVES;PLAZA ETIOPIA, SOBRE HERREROS;8:00 A 19:00 HORAS;19,511662631;-99,206579611
MARTES;PLAZA ETIOPIA, SOBRE HERREROS;8:00 A 19:00 HORAS;19,511662631;-99,206579611
SÁBADO;PLAZA ETIOPIA, SOBRE HERREROS;8:00 A 19:00 HORAS;19,511662631;-99,206579611
SÁBADO;CARRETERA PICACHO AJUSCO CASI ESQ. CON ENCINOS;08:00 A 19:00 HORAS;19,272132410;-99,206076751
JUEVES;CALLE 20 ENT. CALLE 10 Y AVENIDA SANTA LUCIA;8:00 A 17:00 HORAS;19,373395406;-99,206155130
DOMINGO;DURANGO ENT. JALAPA Y OLIVAR;8:00 A 17:00 HORAS;19,337126774;-99,205484127
SÁBADO;SUR 140 ENTRE AV. OBSERVATORIO Y CALLE PONIENTE 75 BIS.;07:00 A 17:00 HORAS;19,402021816;-99,205307546
JUEVES;BANQUETA ORIENTE DE LA AV ALTA TENSION Y BANQUETA NORTE DE LA AV CENTENARIO;8:00 A 17:00 HORAS;19,365399918;-99,205249624
MARTES;PANORAMICA PICACHO AJUSCO Y ENTRADA A LA PRIMAVERA;08:00 A 19:00 HORAS;19,267992964;-99,205001923
VIERNES;YUCATAN ENTRE ADOLFO LOPEZ MATEOS, MONTERREY Y JALISCO;8:00 A 17:00 HORAS;19,336356314;-99,204800122
SÁBADO;CALLE 6 ENTRE CALLE 18 Y 8;8:00 A 17:00 HORAS;19,375032822;-99,204808120
MARTES;LEONA VICARIO /XICOTENCATL Y JOSÉ MA. MORELOS Y PAVON;08:00 A 19:00 HORAS;19,217169593;-99,204357652
MARTES;JOSÉ MA. MORELOS Y PAVON Y LEONA VICARIO;08:00 A 19:00 HORAS;19,217704007;-99,204329486
SÁBADO;LINARES, ENTRE COBRE Y POSTES;8:00 A 17:00 HORAS;19,392490183;-99,204525356
MARTES;MARIANO MATAMOROS / JSÉ MA. MORELOS Y LEONA VICARIO;08:00 A 19:00 HORAS;19,217936313;-99,204290292
DOMINGO;MARIANO MATAMOROS / EMILIANO ZAPATA E IGNACIO ALLENDE;08:00 A 19:00 HORAS;19,221394484;-99,204208846
MIÉRCOLES;SAN JUAN TLIHUACA, ENTRE HERNANDEZ COVARRUBIAS Y 1A  CDA;8:00 A 19:00 HORAS;19,493610146;-99,204489345
LUNES;AV. PADRE HIDALGO ENTRE CALLE 6 Y CALLE 8;8:00 A 17:00 HORAS;19,376229760;-99,204289115
JUEVES;AV. CENTENARIO GUADALUPE HIDALGO Y CTO. 3;8:00 A 17:00 HORAS;19,365569049;-99,204236946
LUNES;AV. CENTENARIO, XOCHIMILCO CTO. 3;8:00 A 17:00 HORAS;19,365237326;-99,204125615
MARTES;RAMÓN CORONA /FRANCISCO PEÑUÑURI, BARTOLOME DE LAS CASAS Y LEONA VICARIO;08:00 A 19:00 HORAS;19,217686390;-99,203756366
MIÉRCOLES;ANDADOR PRINCIPAL SANTO DOMINGO Y LINARES;8:00 A 17:00 HORAS;19,391014999;-99,203714610
LUNES;M.CERVANTES SAAVEDRA ENTRE LAGO ZURICH Y FFCC. CUERNAVACA;07:00 A 17:00 HORAS;19,440209848;-99,203650174
LUNES;PLAZA PALOMARES, ENTRE HERREROS, PESCADORES Y MERCADERES;8:00 A 19:00 HORAS;19,511668676;-99,203558590
MIÉRCOLES;PLAZA PALOMARES, ENTRE HERREROS, PESCADORES Y MERCADERES;8:00 A 19:00 HORAS;19,511668676;-99,203558590
VIERNES;PLAZA PALOMARES, ENTRE HERREROS, PESCADORES Y MERCADERES;8:00 A 19:00 HORAS;19,511668676;-99,203558590
VIERNES;ALFREDO V. BONFIL / JESÚS LECUONA Y CONSTITUCIÓN;08:00 A 19:00 HORAS;19,281398025;-99,203041956
LUNES;TOPILEJO ENTRE TETLA Y ALICAMA;07:00 A 17:00 HORAS;19,422946500;-99,203090945
JUEVES;JACARANDAS Y ANDADOR DE JACARANDAS;8:00 A 19:00 HORAS;19,507485141;-99,202971714
SÁBADO;GALEANA, ENTRE  CANTEMOC Y CAMINO A NEXTENGO;8:00 A 19:00 HORAS;19,478457690;-99,202503026
JUEVES;ROQUE VELASCO CERON, INT UNIDAD SANTA FE;8:00 A 17:00 HORAS;19,387129488;-99,201882846
DOMINGO;MARIANO ESCOBEDO ESQ. PEDRO MARÍA ANAYA;08:00 A 19:00 HORAS;19,225139712;-99,201077747
VIERNES;RIO BECERRA PROLONGACION SAN ANTONIO Y ALTA TENSION;8:00 A 17:00 HORAS;19,380289141;-99,201069140
DOMINGO;NORTE 4 ENTRE LAGO CHAIREL Y RIO SAN JOAQUIN;07:00 A 17:00 HORAS;19,445612707;-99,201006843
SÁBADO;MARIANO ESCOBEDO ESQ. PEDRO MARÍA ANAYA;08:00 A 19:00 HORAS;19,225233732;-99,200719563
SÁBADO;ALBAÑILES Y URANIO ENTRE HIDROGENO Y ARGON, CINCEL Y RENACIMIENTO.;8:00 A 19:00 HORAS;19,509934343;-99,200660560
MIÉRCOLES;ROSA NEGRA ENTRE ROSA DE CASTILLA Y GIOTTO;8:00 A 17:00 HORAS;19,372344560;-99,200432585
JUEVES;LEON FELIPE, PERIFERICO Y FRESNOS;8:00 A 17:00 HORAS;19,350468087;-99,200092564
DOMINGO;PINO SUÁREZ / FELIPE ÁNGELES Y PIPILA;08:00 A 19:00 HORAS;19,282488797;-99,199962923
SÁBADO;ARISTOTELES ENTRE LUIS G. URBINA Y EMILIO CASTELAR;07:00 A 17:00 HORAS;19,429636186;-99,200104040
DOMINGO;NORTE 4 ENTRE LAGO CHAIRELY PONIENTE 115;07:00 A 17:00 HORAS;19,445548136;-99,199738081
DOMINGO;ALBAÑILES, ESQ. ARGON;8:00 A 19:00 HORAS;19,510081516;-99,199636872
MARTES;"INTERIOR UNIDAD H. ""MANUEL RIVERA ANAYA"" CROC 1";8:00 A 19:00 HORAS;19,516324658;-99,199293988
VIERNES;"INTERIOR UNIDAD H. ""MANUEL RIVERA ANAYA"" CROC 1";8:00 A 19:00 HORAS;19,516324658;-99,199293988
VIERNES;MIGUEL DE CERVANTES SAAVEDRA ESQ. CDA. MIGUEL DE CERVANTES SAAVEDRA;07:00 A 17:00 HORAS;19,440909349;-99,198988194
VIERNES;CHAMULAS, ENTRE L. DE TEJADA Y RAFAEL BUELNA;8:00 A 19:00 HORAS;19,488146589;-99,198609778
MARTES;NORTE 4 ENTRE PONIENTE 115-A Y LAGO GINEBRA;07:00 A 17:00 HORAS;19,445478015;-99,198248576
LUNES;PONIENTE 85 Y AV. OBSERVATORIO;8:00 A 17:00 HORAS;19,398887593;-99,197935614
MARTES;TIZIANO ENTRE FRANZ HALLZ Y VAN OSTADE;8:00 A 17:00 HORAS;19,373635893;-99,197407561
DOMINGO;GIOTTO ENTRE TIZIANO JUAN COUSIN;8:00 A 17:00 HORAS;19,374065221;-99,197191519
MARTES;CALLE C ENTRE CALLE 1 Y CALLE 4;8:00 A 17:00 HORAS;19,386617225;-99,196913056
LUNES;JOSEFA ORTIZ DE DOMINGUEZ / JESÚS LECUONA Y PIPILA;08:00 A 19:00 HORAS;19,284142804;-99,196726722
DOMINGO;ADRIAN BROWER, ENTRE RUIZ DAEL Y GIOTTO;8:00 A 17:00 HORAS;19,374016153;-99,196635075
JUEVES;GRAL. JUAN VILLEGAS ENTRE GRAL. SOSTENES ROCHA Y BARRANQUILLA;07:00 A 17:00 HORAS;19,406788664;-99,196419420
DOMINGO;RIO BECERRA ENTRE PERIFERICO Y AV. ALTA TENSION;8:00 A 17:00 HORAS;19,381635911;-99,196257622
MARTES;GUIDO RENI Y FRANZ HALLZ;8:00 A 17:00 HORAS;19,374115668;-99,196214572
DOMINGO;DR. ROSEMBLUETH ENT. AV. LOMAS DE PLATEROS Y P. MIRANDA;8:00 A 17:00 HORAS;19,365699852;-99,195408926
MARTES;DR. ROSEMBLUETH ENTRE FRANCISCO P. MIRANDA Y AV. LOMAS DE PLATEROS;8:00 A 17:00 HORAS;19,365759299;-99,195390706
SÁBADO;DR. ROSEMBLUETH Y AVENIDA LOMAS DE PLATEROS;8:00 A 17:00 HORAS;19,367076951;-99,195256015
MARTES;DR. ROSEMBLUETH Y FRANCISCO P. MIRANDA;8:00 A 17:00 HORAS;19,366539858;-99,194892542
VIERNES;AGUILA ENTRE FAISAN Y CISNE;8:00 A 17:00 HORAS;19,395202282;-99,194270035
LUNES;JESUS A. FLORES ENTRE M. GONZALEZ CALDERON Y GENERAL CHILARDI;07:00 A 17:00 HORAS;19,405972313;-99,194079226
LUNES;CENTEOTL, ENTRE ACAMAPICHTLI Y SAN MATEO;8:00 A 19:00 HORAS;19,485841537;-99,194055178
MARTES;VESUBIO ENTRE CONDOR Y CARPATOS;8:00 A 17:00 HORAS;19,360185586;-99,193334530
JUEVES;ALPES ENTRE ANDES Y PERIFERICO;8:00 A 17:00 HORAS;19,362137875;-99,192588484
VIERNES;ESTIO ENTRE PRIMAVERA Y JUAN TINOCO - INACTIVO;8:00 A 17:00 HORAS;19,363771401;-99,192501023
DOMINGO;FELIPE ANGELES, ZENZONTLE Y CANARIO;8:00 A 17:00 HORAS;19,394048342;-99,192463021
LUNES;LAGO WINNIPEG ENTRE LAGO ERIE Y LAGO ONTARIO;07:00 A 17:00 HORAS;19,455041481;-99,192174883
LUNES;LAGO WINNIPEG ENTRE LAGO ERIE Y LAGO SUPERIOR;07:00 A 17:00 HORAS;19,456354093;-99,191787043
JUEVES;JOSE MARIA TERESA REVOLUCION Y TLACOPAC;8:00 A 17:00 HORAS;19,353310810;-99,191190473
DOMINGO;CAMINO A NEXTENGO, ENTRE CDA. DEL AGUILA Y AV. FF. CC. NACIONALES;8:00 A 17:00 HORAS;19,473347197;-99,191076389
SÁBADO;CASTRO BRITO / CAMELIA Y MIRAMONTES;08:00 A 19:00 HORAS;19,271527590;-99,190620025
SÁBADO;BENITO JUÁREZ ESQ. VERACRUZ;08:00 A 19:00 HORAS;19,284202673;-99,190200311
VIERNES;CALLE BANQUETA EJE 10 SUR, ENTRE AV, COPILCO Y AV UNIVERSIDAD;8:00 A 19:00 HORAS;19,337617111;-99,190243043
DOMINGO;LEONARDO DA VINCI ENTRE SAN ANTONIO Y ANAREO;6:00 A 16:00 HORAS;19,384278744;-99,190053755
MIÉRCOLES;LEONARDO DA VINCI Y SAN ANTONIO;6:00 A 16:00 HORAS;19,384754439;-99,189906410
MIÉRCOLES;ISIDRO FABELA ESQ. CANTERA;08:00 A 19:00 HORAS;19,271771230;-99,189759330
VIERNES;ISIDRO FABELA ESQ. CANTERA;08:00 A 19:00 HORAS;19,271696778;-99,189569196
MARTES;MIGUEL HIDALGO / BENITO  JUÁREZ Y CORREGIDORA;08:00 A 19:00 HORAS;19,283565616;-99,188906257
DOMINGO;21 DE AGOSTO ENTRE VICTORIA Y CUAUHTEMOC;8:00 A 19:00 HORAS;19,339529195;-99,187833110
MIÉRCOLES;PINITOS, ENTRE AV. AZCAPOTZALCO Y CENTENARIO;8:00 A 19:00 HORAS;19,471804304;-99,187854004
SÁBADO;SAGREDO Y JOSE MARIA VELAZCO;6:00 A 16:00 HORAS;19,364417516;-99,187702674
LUNES;ABUNDIO MARTINEZ ENTRE J. ROSAS Y PLAZA VALVERDE;8:00 A 17:00 HORAS;19,355928925;-99,187436793
SÁBADO;CERRO DE LA SILLA / CERRO DE LAS BATALLAS Y CERRO DE LA ESTRELLA;08:00 A 19:00 HORAS;19,259611926;-99,186816977
VIERNES;CDA 10 DE MAYO ENTRE 10 DE MAYO Y 11 DE ABRIL;6:00 A 16:00 HORAS;19,395472803;-99,186599481
MARTES;SAGREDO ENTRE ANDRES DE LA CONCHA Y MERCADERES;6:00 A 16:00 HORAS;19,366987180;-99,186470106
